Le Scuole d'Arte e dei Mestieri di Roma Capitale rappresentano una grande ricchezza culturale e sono una delle più antiche ed accreditate realtà educative della città per l'acquisizione di tecniche artistiche ed artigianali;;
;;
Scuola d'Arte e Mestiere;Indirizzo;Telefono
Scuola Ettore Rolli;Via Macedonia, 120;Tel. 06 78850000 - Fax 06 78394660
Scuola Scienza e Tecnica;Viale Glorioso, 5;Tel. 06 5810018   - Fax 06 5881233
Scuola Arti Ornamentali;Via di San Giacomo, 11;Tel. 06 36001843 - Fax 06 36088035
Scuola Nicola Zabaglia;Piazza San Paolo alla Regola, 43;Tel. 06 6865976   - Fax 06 68199465
